{
  "schema_version": "1.0",
  "kind": "work-item",
  "id": "feat-001-coupons",
  "revision": 1,
  "title": "Aplicar cupones de descuento en checkout",
  "type": "feature",
  "status": "active",
  "created_at": "2026-08-14T23:00:00Z",
  "created_by": {
    "kind": "human",
    "id": "matias"
  },
  "workflow": {
    "id": "feature-standard",
    "version": "1.0",
    "entry_phase": "prd"
  },
  "input": {
    "source": "user_prompt",
    "summary": "Agregar un campo en la sección de checkout para aplicar códigos de descuento."
  },
  "phases": {
    "prd": {
      "status": "in_progress",
      "artifact": "artifacts/prd.md"
    },
    "specification": {
      "status": "blocked"
    },
    "plan": {
      "status": "blocked"
    },
    "implementation": {
      "status": "blocked"
    },
    "verification": {
      "status": "blocked"
    },
    "human-code-review": {
      "status": "blocked"
    },
    "archive": {
      "status": "blocked"
    }
  },
  "traceability": {
    "events": "events.jsonl"
  }
}
